{
  "traceId": "rex-20260404-0003",
  "sessionId": "session-1775282484",
  "file": "/Users/adityadixit/Desktop/power-cli/rexscript/tests/fixtures/valid/when_use_instead.rex",
  "generatedAt": "2026-04-04T06:01:24.397Z",
  "actionCount": 3,
  "duration": 237,
  "haiku": "signals cross the wire / the agent names each failure / nothing stays untraced",
  "actions": [
    {
      "action": "observe",
      "kind": "observe",
      "riskLevel": "LOW",
      "capability": "NETWORK",
      "target": "https://example.com/data",
      "xriskDecision": "ALLOW",
      "policyReason": null,
      "timestamp": "2026-04-04T06:01:24.159Z",
      "duration": 236,
      "haiku": "signals cross the wire / the agent names each failure / nothing stays untraced",
      "result": {
        "url": "https://example.com/data",
        "title": "Untitled Page",
        "confidence": 0.45,
        "adapter": "fetch",
        "status": 0,
        "ok": false
      },
      "loc": {
        "line": 2,
        "column": 3
      }
    },
    {
      "action": "use.instead",
      "kind": "use.instead",
      "riskLevel": "LOW",
      "capability": "FOREIGN_EXEC",
      "target": "sql",
      "xriskDecision": "ALLOW",
      "policyReason": null,
      "timestamp": "2026-04-04T06:01:24.396Z",
      "duration": 1,
      "haiku": "signals cross the wire / the agent names each failure / nothing stays untraced",
      "result": {
        "language": "sql",
        "executor": "native",
        "confidence": 0.99,
        "via": "hint",
        "outputSummary": {
          "type": "object",
          "rowCount": 0
        }
      },
      "loc": {
        "line": 5,
        "column": 5
      }
    },
    {
      "action": "fallback",
      "kind": "emit",
      "riskLevel": "LOW",
      "capability": "NONE",
      "target": null,
      "xriskDecision": "ALLOW",
      "timestamp": "2026-04-04T06:01:24.397Z",
      "duration": 0,
      "haiku": "queries touch the dark / traces bloom in silence / safety keeps the gate",
      "result": {
        "action": "fallback"
      },
      "loc": null
    }
  ],
  "diagnostics": {
    "warnings": [],
    "errors": []
  }
}