{
  "traceId": "rex-20260404-0010",
  "sessionId": "session-0370",
  "file": "/Users/adityadixit/Desktop/power-cli/rexscript/tests/fixtures/valid/when_use_instead.rex",
  "generatedAt": "2026-04-04T06:01:24.517Z",
  "actionCount": 10,
  "duration": 4270,
  "haiku": "queries touch the dark / traces bloom in silence / safety keeps the gate",
  "actions": [
    {
      "action": "TryCatchStatement",
      "kind": "TryCatchStatement",
      "riskLevel": "LOW",
      "capability": "NONE",
      "target": null,
      "xriskDecision": "ALLOW",
      "timestamp": "2026-04-04T06:01:24.516Z",
      "duration": 277,
      "haiku": "pages drift at dusk / context binds each decision / night remembers all",
      "loc": {
        "start": {
          "line": 1,
          "column": 1
        },
        "end": {
          "line": 19,
          "column": 2
        }
      }
    },
    {
      "action": "observe",
      "kind": "ObserveStatement",
      "riskLevel": "LOW",
      "capability": "NETWORK",
      "target": "\"https://example.com/data\"",
      "xriskDecision": "ALLOW",
      "timestamp": "2026-04-04T06:01:24.517Z",
      "duration": 303,
      "haiku": "footsteps in the logs / parallel thoughts hold the line / the answer leaves a trail",
      "loc": {
        "start": {
          "line": 2,
          "column": 3
        },
        "end": {
          "line": 3,
          "column": 1
        }
      }
    },
    {
      "action": "WhenStatement",
      "kind": "WhenStatement",
      "riskLevel": "LOW",
      "capability": "NONE",
      "target": null,
      "xriskDecision": "ALLOW",
      "timestamp": "2026-04-04T06:01:24.517Z",
      "duration": 307,
      "haiku": "footsteps in the logs / parallel thoughts hold the line / the answer leaves a trail",
      "loc": {
        "start": {
          "line": 4,
          "column": 3
        },
        "end": {
          "line": 15,
          "column": 4
        }
      }
    },
    {
      "action": "use.instead",
      "kind": "UseInsteadStatement",
      "riskLevel": "MEDIUM",
      "capability": "FOREIGN_EXEC",
      "target": "sql",
      "xriskDecision": "ALLOW",
      "timestamp": "2026-04-04T06:01:24.517Z",
      "duration": 410,
      "haiku": "queries touch the dark / traces bloom in silence / safety keeps the gate",
      "loc": {
        "start": {
          "line": 5,
          "column": 5
        },
        "end": {
          "line": 10,
          "column": 1
        }
      }
    },
    {
      "action": "UseDefaultStatement",
      "kind": "UseDefaultStatement",
      "riskLevel": "LOW",
      "capability": "NONE",
      "target": null,
      "xriskDecision": "ALLOW",
      "timestamp": "2026-04-04T06:01:24.517Z",
      "duration": 447,
      "haiku": "pages drift at dusk / context binds each decision / night remembers all",
      "loc": {
        "start": {
          "line": 8,
          "column": 7
        },
        "end": {
          "line": 8,
          "column": 20
        }
      }
    },
    {
      "action": "synthesise",
      "kind": "SynthesiseStatement",
      "riskLevel": "MEDIUM",
      "capability": "MODEL",
      "target": null,
      "xriskDecision": "ALLOW",
      "timestamp": "2026-04-04T06:01:24.517Z",
      "duration": 484,
      "haiku": "signals cross the wire / the agent names each failure / nothing stays untraced",
      "loc": {
        "start": {
          "line": 11,
          "column": 5
        },
        "end": {
          "line": 11,
          "column": 42
        }
      }
    },
    {
      "action": "flag",
      "kind": "FlagStatement",
      "riskLevel": "LOW",
      "capability": "NONE",
      "target": null,
      "xriskDecision": "ALLOW",
      "timestamp": "2026-04-04T06:01:24.517Z",
      "duration": 455,
      "haiku": "queries touch the dark / traces bloom in silence / safety keeps the gate",
      "loc": {
        "start": {
          "line": 13,
          "column": 5
        },
        "end": {
          "line": 13,
          "column": 30
        }
      }
    },
    {
      "action": "SkipStatement",
      "kind": "SkipStatement",
      "riskLevel": "LOW",
      "capability": "NONE",
      "target": null,
      "xriskDecision": "ALLOW",
      "timestamp": "2026-04-04T06:01:24.517Z",
      "duration": 492,
      "haiku": "pages drift at dusk / context binds each decision / night remembers all",
      "loc": {
        "start": {
          "line": 14,
          "column": 5
        },
        "end": {
          "line": 14,
          "column": 5
        }
      }
    },
    {
      "action": "emit",
      "kind": "EmitStatement",
      "riskLevel": "LOW",
      "capability": "NONE",
      "target": null,
      "xriskDecision": "ALLOW",
      "timestamp": "2026-04-04T06:01:24.517Z",
      "duration": 529,
      "haiku": "pages drift at dusk / context binds each decision / night remembers all",
      "loc": {
        "start": {
          "line": 17,
          "column": 3
        },
        "end": {
          "line": 17,
          "column": 30
        }
      }
    },
    {
      "action": "SkipStatement",
      "kind": "SkipStatement",
      "riskLevel": "LOW",
      "capability": "NONE",
      "target": null,
      "xriskDecision": "ALLOW",
      "timestamp": "2026-04-04T06:01:24.517Z",
      "duration": 566,
      "haiku": "footsteps in the logs / parallel thoughts hold the line / the answer leaves a trail",
      "loc": {
        "start": {
          "line": 18,
          "column": 3
        },
        "end": {
          "line": 18,
          "column": 3
        }
      }
    }
  ],
  "diagnostics": {
    "warnings": [
      {
        "severity": "warning",
        "code": "WARN020",
        "message": "Executing use.instead without a configured security sandbox",
        "loc": {
          "start": {
            "line": 5,
            "column": 5
          },
          "end": {
            "line": 10,
            "column": 1
          }
        }
      },
      {
        "severity": "warning",
        "code": "WARN005",
        "message": "synthesise confidence not checked after call",
        "loc": {
          "start": {
            "line": 11,
            "column": 5
          },
          "end": {
            "line": 11,
            "column": 42
          }
        }
      }
    ],
    "errors": []
  }
}